{"$defs":{"text":{"maxLength":16384,"minLength":1,"type":"string"}},"$id":"https://schemas.yeisme.dev/promptrepo/ai-drama-character-assets/modular-slot-bundle.v1","$schema":"https://json-schema.org/draft/2020-12/schema","additionalProperties":false,"allOf":[{"if":{"properties":{"slot_id":{"const":"preview"}},"required":["slot_id"]},"then":{"required":["preview_lineage"]}},{"if":{"properties":{"slot_id":{"not":{"const":"preview"}}},"required":["slot_id"]},"then":{"not":{"required":["preview_lineage"]}}}],"properties":{"findings":{"items":{"additionalProperties":false,"properties":{"code":{"maxLength":128,"minLength":2,"pattern":"^[A-Z][A-Z0-9_]*$","type":"string"},"evidence":{"maxLength":2048,"minLength":1,"type":"string"},"repair":{"maxLength":2048,"minLength":1,"type":"string"},"severity":{"enum":["blocking","high","medium","low","unknown"]}},"required":["code","severity","evidence","repair"],"type":"object"},"maxItems":32,"type":"array"},"global_negative_constraints":{"items":{"$ref":"#/$defs/text"},"maxItems":128,"type":"array"},"policy_echo":{"additionalProperties":false,"minProperties":1,"properties":{"age_band":{"enum":["adult","minor","unknown"]},"canvas_policy":{"enum":["transparent_rgba","opaque_full_canvas"]},"coverage_policy":{"enum":["neutral_full","age_appropriate_conservative"]},"preview_purpose":{"enum":["layer_alignment","harmonized_read"]},"safety_gates":{"items":{"additionalProperties":false,"properties":{"applied":{"type":"boolean"},"basis":{"$ref":"#/$defs/text"},"gate":{"maxLength":96,"pattern":"^[A-Z][A-Z0-9_]*$","type":"string"}},"required":["gate","applied"],"type":"object"},"maxItems":32,"type":"array"},"topology_family":{"enum":["humanoid","quadruped","winged","serpentine","mechanical"]}},"type":"object"},"preview_lineage":{"additionalProperties":false,"properties":{"canonical":{"const":false},"purpose":{"enum":["layer_alignment","harmonized_read"]},"source_refs":{"items":{"additionalProperties":false,"properties":{"artifact_digest":{"pattern":"^sha256:[a-f0-9]{64}$","type":"string"},"slot_id":{"enum":["head_core","body_core","surface_coat","wearable","accessory","extension_part","semantic_object","environment_shell"]},"source_version":{"maxLength":256,"minLength":1,"pattern":"^[A-Za-z0-9][A-Za-z0-9:._/@-]{0,255}$","type":"string"},"view_id":{"maxLength":64,"minLength":1,"pattern":"^[a-z0-9][a-z0-9_-]{0,63}$","type":"string"}},"required":["slot_id","source_version","artifact_digest","view_id"],"type":"object"},"maxItems":16,"minItems":1,"type":"array"},"usage_limits":{"$ref":"#/$defs/text"}},"required":["canonical","purpose","source_refs"],"type":"object"},"prompt_sections":{"additionalProperties":false,"properties":{"forbidden_inheritance":{"$ref":"#/$defs/text"},"identity_topology":{"$ref":"#/$defs/text"},"isolation_output_contract":{"$ref":"#/$defs/text"},"material_light_behavior":{"$ref":"#/$defs/text"},"preserve_interfaces":{"$ref":"#/$defs/text"},"slot_design":{"$ref":"#/$defs/text"},"view_camera_lock":{"$ref":"#/$defs/text"}},"required":["identity_topology","slot_design","view_camera_lock","isolation_output_contract","material_light_behavior","preserve_interfaces","forbidden_inheritance"],"type":"object"},"qc_checklist":{"items":{"additionalProperties":false,"properties":{"check":{"$ref":"#/$defs/text"},"observable":{"type":"boolean"}},"required":["check","observable"],"type":"object"},"maxItems":64,"minItems":1,"type":"array"},"reference_policy":{"items":{"additionalProperties":false,"properties":{"forbid":{"items":{"$ref":"#/$defs/text"},"maxItems":128,"type":"array"},"inherit":{"items":{"$ref":"#/$defs/text"},"maxItems":64,"type":"array"},"reference_role":{"maxLength":128,"minLength":1,"type":"string"},"state_note":{"$ref":"#/$defs/text"}},"required":["reference_role","inherit","forbid"],"type":"object"},"maxItems":64,"type":"array"},"schema_version":{"enum":["character_asset.modular_slot_bundle.v1"]},"slot_id":{"enum":["head_core","body_core","surface_coat","wearable","accessory","extension_part","semantic_object","environment_shell","preview"]},"subject_version":{"maxLength":256,"minLength":1,"pattern":"^[A-Za-z0-9][A-Za-z0-9:._/@-]{0,255}$","type":"string"},"template_id":{"maxLength":96,"pattern":"^[a-z][a-z0-9]+(-[a-z0-9]+)*-v[0-9]+$","type":"string"},"views":{"items":{"additionalProperties":false,"properties":{"adaptive_view_reason":{"$ref":"#/$defs/text"},"change_scope":{"enum":["identity_preservation","capture_lock","camera_motion","action_timing","lighting","material_state","layer_state","view_only"]},"instruction":{"$ref":"#/$defs/text"},"negative_constraints":{"items":{"$ref":"#/$defs/text"},"maxItems":128,"type":"array"},"view_key":{"pattern":"^view-[a-z0-9][a-z0-9-]{0,63}$","type":"string"},"view_role":{"enum":["detail_front","front_left_three_quarter","left_profile","back","right_profile","front_right_three_quarter","adaptive"]}},"required":["view_key","view_role","instruction","negative_constraints","change_scope"],"type":"object"},"maxItems":8,"minItems":1,"type":"array"}},"propertyNames":{"not":{"enum":["canonical_ref","asset_ref","digest","timestamp","idempotency","expected_version","accepted","rejected","frozen","delivered","budget","budget_receipt","provider","provider_payload","model","credential","credentials","raw_prompt","hidden_prompt","tool_call","seed"]}},"required":["schema_version","template_id","slot_id","subject_version","reference_policy","prompt_sections","views","policy_echo","global_negative_constraints","qc_checklist","findings"],"title":"Modular slot Prompt Bundle v1","type":"object"}