{"findings":[],"global_negative_constraints":["头发","假发","发际线造型","发饰","簪子","珠花","头冠","耳饰","项链","脖子","肩膀","衣服","背景","地面","投影","白底","黑底","棋盘格","伪透明边缘","多视图拼图","文字","水印","边框"],"policy_echo":{"age_band":"adult","canvas_policy":"transparent_rgba","safety_gates":[{"applied":true,"basis":"头部身份锚点来自 DesignSpec","gate":"IDENTITY_ANCHOR_LOCKED"},{"applied":true,"basis":"不适用：adult","gate":"NO_MINOR_ADULTIFICATION"}],"topology_family":"humanoid"},"prompt_sections":{"forbidden_inheritance":"不继承表情、妆容、首饰、服装、背景；未声明字段一律禁止。","identity_topology":"成年女性头部核心：鹅蛋脸、眉目清朗、左眉尾小疤；humanoid 头部拓扑。","isolation_output_contract":"独立透明 RGBA 画布，干净抗锯齿边缘，头部在画布内完整闭合。","material_light_behavior":"真实皮肤纹理与头皮材质，均匀柔光，无妆容。","preserve_interfaces":"颅顶/头皮接口、发际线接口、双耳贴合位、下颌与颈部衔接边界（颈部不入画）。","slot_design":"无头发头模，保留头皮/发际线/耳位接口供上层资产贴合。","view_camera_lock":"本轮唯一视图 front_left_three_quarter，正交感镜头，独立单图。"},"qc_checklist":[{"check":"完整头顶、后脑轮廓、双耳、自然头皮、完整下颌在场","observable":true},{"check":"无头发与发饰污染","observable":true},{"check":"透明 RGBA 与干净抗锯齿边缘","observable":true},{"check":"视图角度与本轮 view_id 一致","observable":true},{"check":"头皮/发际线/耳位接口未被覆盖","observable":true},{"check":"无背景、地面与文字","observable":true}],"reference_policy":[{"forbid":["expression","makeup","jewelry","wardrobe","background"],"inherit":["head_shape","scalp_contour","attachment_landmarks"],"reference_role":"head_core_source"},{"forbid":["creator_identity","protected_works"],"inherit":["color_palette","stroke_softness"],"reference_role":"style_source"}],"schema_version":"character_asset.modular_slot_bundle.v1","slot_id":"head_core","subject_version":"subject:lin-wan-01@v1","template_id":"head-core-bald-v1","views":[{"change_scope":"view_only","instruction":"左前 3/4 视图：同一头部事实，等比例同镜头距离，双耳与颅顶可见。","negative_constraints":["头发","假发","发际线造型","发饰","簪子","珠花","头冠","耳饰","项链","脖子","肩膀","衣服","背景","地面","投影","白底","黑底","棋盘格","伪透明边缘","多视图拼图","文字","水印","边框"],"view_key":"view-front-left-three-quarter","view_role":"front_left_three_quarter"}]}