{"findings":[{"code":"EXPLICIT_ANATOMY_REQUESTED","evidence":"design_spec 要求显式解剖细节，任何年龄都不允许。","repair":"改用 neutral_full 完整中性覆盖。","severity":"blocking"}],"global_negative_constraints":["显式解剖","成人化表达"],"policy_echo":{"age_band":"adult","canvas_policy":"transparent_rgba","coverage_policy":"neutral_full","safety_gates":[{"applied":true,"basis":"任何年龄都不得要求显式解剖","gate":"NO_EXPLICIT_ANATOMY"}],"topology_family":"humanoid"},"prompt_sections":{"forbidden_inheritance":"禁止显式解剖。","identity_topology":"身体核心。","isolation_output_contract":"透明 RGBA。","material_light_behavior":"中性材质。","preserve_interfaces":"接口保留。","slot_design":"中性覆盖。","view_camera_lock":"detail_front。"},"qc_checklist":[{"check":"移除解剖要求后重编译","observable":true}],"reference_policy":[{"forbid":["anatomy"],"inherit":[],"reference_role":"body_core_source"}],"schema_version":"character_asset.modular_slot_bundle.v1","slot_id":"body_core","subject_version":"subject:lin-wan-01@v1","template_id":"body-core-neutral-v1","views":[{"change_scope":"view_only","instruction":"阻断：修复后重新编译。","negative_constraints":["不生成"],"view_key":"view-detail-front","view_role":"detail_front"}]}