{"findings":[{"code":"WEARABLE_SINGLE_ITEM_VIOLATION","evidence":"design_spec.items 打包三件服装（内衫、长裙、鞋），违反单件合同。","repair":"每件单独一份 DesignSpec 与 fitted render；套装由消费方按层级组合。","severity":"blocking"}],"global_negative_constraints":["脸","五官","发际线","发型","表情","妆容","身体皮肤","裸露躯干","其他服装单件","首饰","配饰","背景","地面","投影","白底","黑底","棋盘格","伪透明边缘","多视图拼图","品牌 Logo","可读文字","水印","边框","未成年人成人化剪裁"],"policy_echo":{"age_band":"adult","canvas_policy":"transparent_rgba","safety_gates":[{"applied":true,"basis":"单件合同生效","gate":"SINGLE_ITEM_ENFORCED"}],"topology_family":"humanoid"},"prompt_sections":{"forbidden_inheritance":"禁止多件打包。","identity_topology":"身体比例锚点。","isolation_output_contract":"透明 RGBA。","material_light_behavior":"丝绸材质。","preserve_interfaces":"贴合点保留。","slot_design":"单件服装。","view_camera_lock":"detail_front。"},"qc_checklist":[{"check":"按单件拆分为三个独立资产后重编译","observable":true}],"reference_policy":[{"forbid":["bundled_items"],"inherit":["body_proportion"],"reference_role":"body_core_source"}],"schema_version":"character_asset.modular_slot_bundle.v1","slot_id":"wearable","subject_version":"subject:lin-wan-01@v1","template_id":"wearable-garment-v1","views":[{"change_scope":"view_only","instruction":"阻断：拆分单件后重新编译。","negative_constraints":["不生成"],"view_key":"view-detail-front","view_role":"detail_front"}]}