{"findings":[],"global_negative_constraints":["脸","五官","表情","妆容","发际线重画","耳饰","项链","簪子","珠花","头冠","头模皮肤","脖子","肩膀","衣服","背景","地面","投影","白底","黑底","棋盘格","伪透明边缘","多视图拼图","文字","水印","边框"],"policy_echo":{"age_band":"adult","canvas_policy":"transparent_rgba","safety_gates":[{"applied":true,"basis":"只继承头型与头皮接口","gate":"IDENTITY_ANCHOR_PRESERVED"},{"applied":true,"basis":"不适用","gate":"LEGACY_COMPAT_ONLY"}],"topology_family":"humanoid"},"prompt_sections":{"forbidden_inheritance":"不继承五官、表情、首饰、服装、背景。","identity_topology":"成年女性头部锚点：鹅蛋脸头型与头皮轮廓，humanoid。","isolation_output_contract":"透明 RGBA，发层完整闭合，允许头皮接触带。","material_light_behavior":"哑光黑发材质，真实发流。","preserve_interfaces":"发际线/颅顶接口保留。","slot_design":"可替换头发层：低束发髻，深黑主区。","view_camera_lock":"detail_front，等比例同镜头距离，独立单图。"},"qc_checklist":[{"check":"贴合接口与 head core landmark 一致","observable":true},{"check":"轮廓/分区/颜色与 DesignSpec 一致","observable":true},{"check":"无五官/表情/首饰/服装/背景污染","observable":true},{"check":"透明 RGBA 与边缘干净","observable":true},{"check":"视图角度与 view_id 一致","observable":true}],"reference_policy":[{"forbid":["facial_features","expression","jewelry","wardrobe","background"],"inherit":["head_shape","scalp_contour","hairline_landmarks"],"reference_role":"head_core_source"}],"schema_version":"character_asset.modular_slot_bundle.v1","slot_id":"surface_coat","subject_version":"subject:lin-wan-01@v1","template_id":"surface-coat-hair-v1","views":[{"change_scope":"view_only","instruction":"正面贴合渲染：低束发髻贴合同一发际线接口，双耳上缘轻度遮挡，独立单图。","negative_constraints":["脸","五官","表情","妆容","发际线重画","耳饰","项链","簪子","珠花","头冠","头模皮肤","脖子","肩膀","衣服","背景","地面","投影","白底","黑底","棋盘格","伪透明边缘","多视图拼图","文字","水印","边框"],"view_key":"view-detail-front","view_role":"detail_front"}]}