{"findings":[{"code":"PREVIEW_SOURCE_LINEAGE_MISSING","evidence":"source_refs_json 为空，分层预览缺少 exact source lineage。","repair":"补齐每个 source 的 slot_id、source_version、artifact_digest 与 view_id 后重编译。","severity":"blocking"}],"global_negative_constraints":["改写任何 source 的设计事实或 digest","作为任何 source slot 的替代 ref","宣称 canonical、subject frozen、production ready","新增未声明图层、角色或场景","文字","Logo","水印","边框","多视图拼图"],"policy_echo":{"canvas_policy":"transparent_rgba","preview_purpose":"layer_alignment","safety_gates":[{"applied":true,"basis":"预览非 canonical 资产","gate":"PREVIEW_NOT_CANONICAL"},{"applied":true,"basis":"lineage 精确回显","gate":"SOURCE_LINEAGE_EXACT"}]},"preview_lineage":{"canonical":false,"purpose":"layer_alignment","source_refs":[{"artifact_digest":"sha256:995b22dc4023327e9188c914e6573a711e579b4871b011ed0beb4e5c5f720027","slot_id":"body_core","source_version":"slot:body-core-neutral-v1@rev-0002","view_id":"detail_front"},{"artifact_digest":"sha256:0f4d3d3b709b29b41183dc503062e42ab80ed2146ac034bbd0ee2870aca1d747","slot_id":"head_core","source_version":"slot:head-core-bald-v1@rev-0003","view_id":"detail_front"},{"artifact_digest":"sha256:78e47cdcad87dfc087a617409a008d247f9e28d01eba2f9a894edae00b7b1d53","slot_id":"surface_coat","source_version":"slot:surface-coat-hair-v1@rev-0004","view_id":"detail_front"},{"artifact_digest":"sha256:a007531ab58ee741a47988287737368e8e9f0c52e283f33de507696798fe54ff","slot_id":"wearable","source_version":"slot:wearable-garment-v1@rev-0005","view_id":"detail_front"}],"usage_limits":"仅用于人工检查；不得作为任何 source slot 的替代 ref 或 canonical 输入。"},"prompt_sections":{"forbidden_inheritance":"不扩展继承范围；未声明字段禁止。","identity_topology":"主体由 source slots 共同定义；预览只读。","isolation_output_contract":"按渲染策略画布输出；无文字与边框。","material_light_behavior":"材质与光只读呈现。","preserve_interfaces":"source 设计事实与接口全部保留。","slot_design":"分层/协调检查预览，不创建新真源。","view_camera_lock":"单一合成视图，镜头随 source 视图锁定。"},"qc_checklist":[{"check":"source_refs 与输入逐项一致且排序稳定","observable":true},{"check":"各层视图与本轮合成视图匹配","observable":true},{"check":"canonical=false 与 usage_limits 在场","observable":true},{"check":"无新增图层/角色","observable":true},{"check":"无文字/边框污染","observable":true}],"reference_policy":[{"forbid":["rewrite","extend_scope"],"inherit":["read_only"],"reference_role":"head_core_source"},{"forbid":["rewrite","extend_scope"],"inherit":["read_only"],"reference_role":"body_core_source"},{"forbid":["rewrite","extend_scope"],"inherit":["read_only"],"reference_role":"surface_coat_source"},{"forbid":["rewrite","extend_scope"],"inherit":["read_only"],"reference_role":"wearable_source"}],"schema_version":"character_asset.modular_slot_bundle.v1","slot_id":"preview","subject_version":"subject:lin-wan-01@v1","template_id":"character-layer-preview-v1","views":[{"change_scope":"layer_state","instruction":"分层合成检查：head/body/hair/garment 按声明层级叠放，报告对齐、穿插与遮挡问题，独立单图。","negative_constraints":["改写 source 设计事实","把预览当作替代 ref","新增未声明图层或角色","文字","边框","多视图拼图"],"view_key":"view-detail-front","view_role":"detail_front"}]}